{
  "schema_version": 1,
  "kind": "system.session",
  "source": "docs/system/04-conductor-os.md:113",
  "note": "会话状态机（6 状态）与六种玩法模式（各含目标 / 默认动作 / 推进 / 结束条件 / 陷阱）。",
  "declared": {
    "states": 6,
    "modes": 6
  },
  "states": [
    {"id": "session_boot", "name": "SESSION_BOOT", "role": "开场：载入账本、重申边界、暖场",
     "source": "docs/system/04-conductor-os.md:119"},
    {"id": "scene_set", "name": "SCENE_SET", "role": "设置：地点、在场者、钩子、张力输入",
     "source": "docs/system/04-conductor-os.md:123"},
    {"id": "turn_loop", "name": "TURN_LOOP", "role": "循环：提问 → 裁决 → 叙事 → 钩子",
     "source": "docs/system/04-conductor-os.md:127"},
    {"id": "scene_resolve", "name": "SCENE_RESOLVE", "role": "收束：本场景目标是否达成？",
     "source": "docs/system/04-conductor-os.md:131"},
    {"id": "checkpoint", "name": "CHECKPOINT", "role": "存档：刷新账本、结算点位、选择下一场景",
     "source": "docs/system/04-conductor-os.md:135"},
    {"id": "session_wrap", "name": "SESSION_WRAP", "role": "收场：确认意犹未尽处与未来伏笔",
     "source": "docs/system/04-conductor-os.md:139"}
  ],
  "modes": [
    {"id": "exploration", "name": "探索模式", "en": "EXPLORATION",
     "goal": "让玩家发现空间的价值：出口、资源、威胁、线索、氛围",
     "default_action": "描述 → 提供 3 个可被操作的对象 → 等待",
     "advance": "每个时段一次风险判定（「时段」= 一天四段之一）",
     "end_condition": "玩家找到一个有意义的东西，或消耗了预设的时间",
     "pitfall": "不要让探索变成「你走到走廊尽头，什么都没有」",
     "source": "docs/system/04-conductor-os.md:145"},
    {"id": "social", "name": "交涉模式", "en": "SOCIAL",
     "goal": "让至少一个立场发生变化（不一定是说服成功）",
     "default_action": "NPC 表达欲望 → 玩家应对 → NPC 反应 → 立场值变化",
     "advance": "使用 docs/system/03 第 2 节的论战结构",
     "end_condition": "立场归零 / 破裂 / 玩家主动退出",
     "pitfall": "不要让 NPC 显得像自动贩卖机——他要有自己的诉求",
     "source": "docs/system/04-conductor-os.md:155"},
    {"id": "investigation", "name": "调查模式", "en": "INVESTIGATION",
     "goal": "至少给出一条真实线索，让玩家在推理板上写东西",
     "default_action": "呈现素材 → 允许两种以上获取路径 → 回应玩家的假设",
     "advance": "线索计数，达到 3 条即可形成结论",
     "end_condition": "形成了结论，或时间压力触发",
     "pitfall": "不要让玩家卡住超过一轮而不提供新的信息入口",
     "source": "docs/system/04-conductor-os.md:165"},
    {"id": "combat", "name": "战斗模式", "en": "COMBAT",
     "goal": "让玩家破解一个包含阶段递进与破韧的战术谜题",
     "default_action": "生成 2–4 个场地要素 → 敌按分组行动 → 提示连携窗口",
     "advance": "回合 / 破韧 / 组合技",
     "end_condition": "敌方全灭 / 撤退 / 士气崩溃 / 第三方介入",
     "pitfall": "不要在第三回合就让玩家陷入无解的消耗战；及时引入变量",
     "source": "docs/system/04-conductor-os.md:175"},
    {"id": "chase", "name": "追逐模式", "en": "CHASE",
     "goal": "让地点本身成为故事（不断切换的场景）",
     "default_action": "每轮双方各掷一次 → 演出一次环境转化 → 更新距离",
     "advance": "三次成功即达成",
     "end_condition": "追上 / 甩脱 / 第三方介入改变规则",
     "pitfall": "不要让追逐超过 4 轮；第 4 轮必须发生一次转折",
     "source": "docs/system/04-conductor-os.md:185"},
    {"id": "downtime", "name": "休整模式", "en": "DOWNTIME",
     "goal": "让角色在叙事上「活过一段时间」",
     "default_action": "每人一个间幕行动 + 至少一段 vignette",
     "advance": "时间跳跃、世界变化概述",
     "end_condition": "所有人完成行动或有未完成的钩子",
     "pitfall": "不要让休整变成纯结算——它是角色养成个人线的最佳时机",
     "source": "docs/system/04-conductor-os.md:195"}
  ],
  "announcement": {
    "rule": "切换模式时明确说出来，这能显著降低 AI 表达的混乱（例如「我们进入战斗——先让我描述一下场地。」）。",
    "source": "docs/system/04-conductor-os.md:207"
  }
}
